{
  "masterDefendantId": "1da3dc44-6e4d-43a7-bfba-745e27da2d7c",
  "orderingCourt": {
    "address": {
      "address1": "Norwich Place",
      "address2": "Bexleyheath",
      "address3": "Kent",
      "address4": "",
      "address5": "",
      "postcode": "DA6 7ND"
    },
    "code": "B01BH00",
    "courtHearingLocation": "B01BH01",
    "id": "7e967376-eacf-4fca-9b30-21b0c5aad427",
    "lja": {
      "ljaCode": "2575",
      "ljaName": "South East London Magistrates' Court"
    },
    "name": "Bexley Magistrates' Court",
    "roomId": "8e912353-3b5d-36c3-953e-ad3b94b19de3",
    "roomName": "Courtroom 01"
  },
  "nowContent": {
    "orderDate": "2026-04-02",
    "defendant": {
      "dateOfBirth": "2005-11-11",
      "gender": "MALE",
      "driverNumber": "VANFL002222OW9PH",
      "title": "Mr",
      "firstName": "Lavinia",
      "lastName": "Marvin",
      "name": "Lavinia Marvin",
      "address": {
        "line1": "9999A9999AAAA",
        "line2": "Woodlane",
        "line3": "addressline 3",
        "line4": "Bristol",
        "line5": "Avon",
        "postCode": "SW11 3TQ"
      }
    },
    "caseApplicationReferences": [
      "28DI3871009"
    ],
    "cases": [
      {
        "caseStatus": "INACTIVE",
        "initiationCode": "C",
        "reference": "28DI3871009",
        "caseId": "40dd59b4-4f02-48f5-b0fa-90eb6c56a00e",
        "defendantCaseOffences": [
          {
            "title": "Conspire to assault a person thereby occasioning them actual bodily harm",
            "civilOffence": false,
            "convictionStatus": "Not Convicted",
            "code": "OF61102C",
            "modeOfTrial": "Indictable",
            "endorsableFlag": false,
            "wording": "Lavinia Marvin at Howell Port, conspired together with Earnest Renner to assault Mack Hahn, thereby occasioning actual bodily harm.",
            "startDate": "2022-12-12",
            "results": [
              {
                "resultIdentifier": "969f150c-cd05-46b0-9dd9-30891efcc766",
                "publishedForNows": false,
                "prompts": [
                  {
                    "promptIdentifier": "7cd1472f-2379-4f5b-9e67-98a43d86e122",
                    "promptReference": "AOF",
                    "label": "Amount of fine",
                    "value": "£200.00"
                  }
                ],
                "resultDefinitionGroup": "Imposition",
                "d20": false,
                "judicialResultCategory": "FINAL",
                "label": "Fine"
              },
              {
                "resultIdentifier": "f121db73-57fb-4f74-9ab1-0843aabe4605",
                "publishedForNows": false,
                "prompts": [
                  {
                    "promptIdentifier": "dcaf502b-44d2-4be0-acfc-2f7d29142da6",
                    "promptReference": "specialReasons",
                    "label": "Special reasons",
                    "value": "tets"
                  }
                ],
                "d20": false,
                "judicialResultCategory": "ANCILLARY",
                "label": "No endorsement - Special Reasons"
              },
              {
                "resultIdentifier": "a0b426c1-74b8-43cd-9885-f0f31625352e",
                "publishedForNows": false,
                "prompts": [
                  {
                    "promptIdentifier": "ee7d253a-c629-11e8-a355-529269fb1459",
                    "promptReference": "PBD",
                    "label": "Date to pay in full by",
                    "value": "03/03/2028"
                  }
                ],
                "resultDefinitionGroup": "Payment terms",
                "d20": false,
                "judicialResultCategory": "ANCILLARY",
                "label": "Payment terms - on release"
              }
            ]
          },
          {
            "title": "Public service vehicles - passenger failing to pay fare",
            "civilOffence": false,
            "convictionStatus": "Not Convicted",
            "code": "PS90015",
            "modeOfTrial": "Summary",
            "endorsableFlag": false,
            "wording": "Public service vehicles - passenger failing to pay fare",
            "startDate": "2022-11-28",
            "results": [
              {
                "resultIdentifier": "969f150c-cd05-46b0-9dd9-30891efcc766",
                "publishedForNows": false,
                "prompts": [
                  {
                    "promptIdentifier": "7cd1472f-2379-4f5b-9e67-98a43d86e122",
                    "promptReference": "AOF",
                    "label": "Amount of fine",
                    "value": "£250.00"
                  }
                ],
                "resultDefinitionGroup": "Imposition",
                "d20": false,
                "judicialResultCategory": "FINAL",
                "label": "Fine"
              },
              {
                "resultIdentifier": "f121db73-57fb-4f74-9ab1-0843aabe4605",
                "publishedForNows": false,
                "prompts": [
                  {
                    "promptIdentifier": "dcaf502b-44d2-4be0-acfc-2f7d29142da6",
                    "promptReference": "specialReasons",
                    "label": "Special reasons",
                    "value": "test"
                  }
                ],
                "d20": false,
                "judicialResultCategory": "ANCILLARY",
                "label": "No endorsement - Special Reasons"
              }
            ]
          },
          {
            "title": "Robbery",
            "civilOffence": false,
            "convictionStatus": "Not Convicted",
            "code": "TH68023",
            "modeOfTrial": "Indictable",
            "endorsableFlag": false,
            "wording": "From 13th November 2018, an aggravated version of this offence applies where the offence is committed against an emergency worker acting in the exercise of his / her functions as such a worker, as per section 1 of the Assaults on emergency Workers (Offences) Act 2018; see offence wording document H19568.",
            "startDate": "2019-11-28",
            "results": [
              {
                "resultIdentifier": "554c2622-c1cc-459e-a98d-b7f317ab065c",
                "publishedForNows": false,
                "prompts": [
                  {
                    "promptIdentifier": "d3205319-84cf-4c5b-9d7a-7e4bb1865054",
                    "promptReference": "periodofConditionalDischarge",
                    "durationSequence": 1,
                    "label": "Period of conditional discharge",
                    "value": "12 Months"
                  }
                ],
                "d20": false,
                "dvlaCode": "E",
                "judicialResultCategory": "FINAL",
                "label": "Conditional discharge"
              }
            ]
          }
        ]
      }
    ],
    "courtApplications": [
      {
        "applicationType": "Application to reopen case",
        "applicationTypeId": "9d2ae0fe-d4d0-43ca-ab7a-7a2556cafe5e",
        "applicationReceivedDate": "2026-04-01",
        "id": "37907da8-0836-4a66-9f7b-fc840798674e",
        "applicationReference": "28DI3871009",
        "applicationStatus": "FINALISED",
        "results": [
          {
            "resultIdentifier": "2b3f7c20-8fc1-4fad-9076-df196c24b27e",
            "publishedForNows": false,
            "d20": false,
            "judicialResultCategory": "FINAL",
            "label": "Granted"
          },
          {
            "resultIdentifier": "e3fb46ee-e406-4f73-9bf1-71d513da8cc7",
            "publishedForNows": false,
            "prompts": [
              {
                "promptIdentifier": "3872ea68-92d9-469f-9929-c676745982ef",
                "promptReference": "reopenedUnder",
                "label": "Re-opened under",
                "value": "Section 155 Powers of Criminal Courts (Sentencing) Act 2000"
              },
              {
                "promptIdentifier": "5797feb0-7678-4193-ad16-944365e9a68a",
                "promptReference": "convictionAndSentenceImposedOnSpecifiedDateAreSetAside",
                "label": "Conviction and sentence imposed on specified date are set aside",
                "value": "03/03/2027"
              },
              {
                "promptIdentifier": "0a7dd6aa-f7cc-43d7-ba03-c9621f3e4471",
                "promptReference": "prosecutortobenotifiedOrganisationName",
                "label": "Prosecutor to be notified organisation name",
                "value": "test"
              },
              {
                "promptIdentifier": "0a7dd6aa-f7cc-43d7-ba03-c9621f3e4471",
                "promptReference": "prosecutortobenotifiedAddress1",
                "label": "Prosecutor to be notified address line 1",
                "value": "test"
              },
              {
                "promptIdentifier": "0a7dd6aa-f7cc-43d7-ba03-c9621f3e4471",
                "promptReference": "prosecutortobenotifiedPostCode",
                "label": "Prosecutor to be notified post code",
                "value": "MK6 7AS"
              }
            ],
            "d20": false,
            "judicialResultCategory": "FINAL",
            "label": "Case reopened"
          }
        ]
      }
    ]
  },
  "isReshare": false,
  "orderingHearingId": "791384d8-b6fb-4d01-a735-23826b08463e"
}