{
  "masterDefendantId": "4da0a1c6-c0a9-49d8-9226-b5f560947de5",
  "orderingCourt": {
    "address": {
      "address1": "The Magistrates' Court",
      "address2": "Barclay Road",
      "address3": "Croydon",
      "address4": "",
      "address5": "",
      "postcode": "CR9 3NG"
    },
    "code": "B01EF00",
    "courtHearingLocation": "B01EF01",
    "id": "31b3d313-7a7c-4598-bb4b-c1bff9b00e26",
    "lja": {
      "ljaCode": "2576",
      "ljaName": "South London Magistrates' Court"
    },
    "name": "Croydon Magistrates' Court",
    "roomId": "bfb67c13-789c-373b-b442-52b82faf863e",
    "roomName": "Courtroom 01"
  },
  "nowContent": {
    "orderDate": "2026-03-25",
    "defendant": {
      "dateOfBirth": "2005-11-11",
      "gender": "MALE",
      "driverNumber": "VANFL002222OW9PH",
      "title": "Mr",
      "firstName": "Else",
      "lastName": "Brown",
      "name": "Else Brown",
      "address": {
        "line1": "9999A9999AAAA",
        "line2": "Woodlane",
        "line3": "addressline 3",
        "line4": "Bristol",
        "line5": "Avon",
        "postCode": "SW11 3TQ"
      }
    },
    "caseApplicationReferences": [
      "28DI1149025"
    ],
    "cases": [
      {
        "caseStatus": "INACTIVE",
        "initiationCode": "C",
        "reference": "28DI1149025",
        "caseId": "de7368e9-58e8-4fe1-bde4-4239d61d7e33",
        "defendantCaseOffences": [
          {
            "title": "Conspire to assault a person thereby occasioning them actual bodily harm",
            "civilOffence": false,
            "convictionStatus": "Not Convicted",
            "code": "OF61102C",
            "modeOfTrial": "Indictable",
            "endorsableFlag": false,
            "wording": "Else Brown at Sally Lodge, conspired together with Ms. Patrick Ortiz to assault Josh Parisian DDS, thereby occasioning actual bodily harm.",
            "startDate": "2022-12-12",
            "results": [
              {
                "resultIdentifier": "3e859586-bc86-407d-bd8e-c9a01d40d147",
                "publishedForNows": false,
                "d20": false,
                "label": "Offence not dealt with as part of application - original adjudication to stand"
              }
            ]
          },
          {
            "title": "Public service vehicles - passenger failing to pay fare",
            "civilOffence": false,
            "convictionStatus": "Not Convicted",
            "code": "PS90015",
            "modeOfTrial": "Summary",
            "endorsableFlag": false,
            "wording": "Public service vehicles - passenger failing to pay fare",
            "startDate": "2022-11-28",
            "results": [
              {
                "resultIdentifier": "3e859586-bc86-407d-bd8e-c9a01d40d147",
                "publishedForNows": false,
                "d20": false,
                "label": "Offence not dealt with as part of application - original adjudication to stand"
              }
            ]
          },
          {
            "title": "Robbery",
            "civilOffence": false,
            "convictionStatus": "Not Convicted",
            "code": "TH68023",
            "modeOfTrial": "Indictable",
            "endorsableFlag": false,
            "wording": "From 13th November 2018, an aggravated version of this offence applies where the offence is committed against an emergency worker acting in the exercise of his / her functions as such a worker, as per section 1 of the Assaults on emergency Workers (Offences) Act 2018; see offence wording document H19568.",
            "startDate": "2019-11-28",
            "results": [
              {
                "resultIdentifier": "b0aeb4fc-df63-4e2f-af88-97e3f23e847f",
                "publishedForNows": false,
                "d20": true,
                "label": "Driving record endorsed (no points)"
              },
              {
                "resultIdentifier": "c3a39c2f-b056-442f-8dfc-604b5434f956",
                "publishedForNows": true,
                "d20": false,
                "label": "0: None or unknown"
              }
            ]
          }
        ]
      }
    ],
    "courtApplications": [
      {
        "applicationType": "Application to reopen case",
        "applicationTypeId": "9d2ae0fe-d4d0-43ca-ab7a-7a2556cafe5e",
        "applicationReceivedDate": "2026-03-24",
        "id": "efa213e9-08a6-4621-9808-d5b4543ac7a0",
        "applicationReference": "28DI1149025",
        "applicationStatus": "FINALISED",
        "results": [
          {
            "resultIdentifier": "2b3f7c20-8fc1-4fad-9076-df196c24b27e",
            "publishedForNows": false,
            "d20": false,
            "label": "Granted"
          },
          {
            "resultIdentifier": "e3fb46ee-e406-4f73-9bf1-71d513da8cc7",
            "publishedForNows": false,
            "prompts": [
              {
                "promptIdentifier": "3872ea68-92d9-469f-9929-c676745982ef",
                "promptReference": "reopenedUnder",
                "label": "Re-opened under",
                "value": "Section 142 Magistrates' Courts Act 1980"
              },
              {
                "promptIdentifier": "5797feb0-7678-4193-ad16-944365e9a68a",
                "promptReference": "convictionAndSentenceImposedOnSpecifiedDateAreSetAside",
                "label": "Conviction and sentence imposed on specified date are set aside",
                "value": "06/06/2026"
              },
              {
                "promptIdentifier": "0a7dd6aa-f7cc-43d7-ba03-c9621f3e4471",
                "promptReference": "prosecutortobenotifiedOrganisationName",
                "label": "Prosecutor to be notified organisation name",
                "value": "test"
              },
              {
                "promptIdentifier": "0a7dd6aa-f7cc-43d7-ba03-c9621f3e4471",
                "promptReference": "prosecutortobenotifiedAddress1",
                "label": "Prosecutor to be notified address line 1",
                "value": "test"
              },
              {
                "promptIdentifier": "0a7dd6aa-f7cc-43d7-ba03-c9621f3e4471",
                "promptReference": "prosecutortobenotifiedPostCode",
                "label": "Prosecutor to be notified post code",
                "value": "MK3 5GH"
              }
            ],
            "d20": false,
            "label": "Case reopened"
          }
        ]
      }
    ]
  },
  "isReshare": false,
  "orderingHearingId": "a89367d5-d3ff-4725-8556-664662169aed"
}