{
  "masterDefendantId": "%DEFENDANT_ID%",
  "orderingCourt": {
    "address": {
      "address1": "176A Lavender Hill",
      "address2": "London",
      "address3": "",
      "address4": "",
      "address5": "",
      "postcode": "SW11 1JU"
    },
    "code": "B01LY00",
    "courtHearingLocation": "B01LY01",
    "id": "f8254db1-1683-483e-afb3-b87fde5a0a26",
    "lja": {
      "ljaCode": "2577",
      "ljaName": "South West London Magistrates' Court"
    },
    "name": "Lavender Hill Magistrates' Court",
    "roomId": "9e4932f7-97b2-3010-b942-ddd2624e4dd8",
    "roomName": "Courtroom 01"
  },
  "nowContent": {
    "orderDate": "2023-05-05",
    "defendant": {
      "dateOfBirth": "2000-09-09",
      "gender": "MALE",
      "driverNumber": "ABCDE0,0010BCFAA",
      "title": "MR",
      "firstName": "Jazmyn",
      "middleName": "Jasmine Jasmine",
      "lastName": "Terry",
      "name": "Jazmyn Jasmine Jasmine Terry",
      "address": {
        "line1": "56saon",
        "line2": "56Police House",
        "line3": "StreetDescription1",
        "line4": "Locality1",
        "line5": "Janechester",
        "postCode": "TW14 9XJ"
      }
    },
    "caseApplicationReferences": [
      "JW98466038"
    ],
    "cases": [
      {
        "reference": "JW98466038",
        "caseId": "5e7683eb-74d1-4748-bb7c-85422c4d3307",
        "defendantCaseOffences": [
          {
            "title": "Drive motor vehicle fail comply with red / green arrow / lane closure traffic light signals - manual detection",
            "civilOffence": false,
            "dvlaCode": "TS10",
            "endDate": "2020-09-17",
            "convictionStatus": "Not Convicted",
            "vehicleRegistration": "TE4654",
            "alcoholReadingAmount": 500,
            "alcoholReadingMethodCode": "A",
            "alcoholReadingMethodDescription": "Blood",
            "code": "RT88971",
            "modeOfTrial": "Summary",
            "endorsableFlag": true,
            "wording": "Has a violent past and fear that he will commit further offences and interfere with witnesse",
            "startDate": "2020-09-18",
            "results": [
              {
                "resultIdentifier": "cee54856-4450-4f28-a8a9-72b688726201",
                "publishedForNows": false,
                "prompts": [
                  {
                    "promptIdentifier": "a8719de4-7783-448a-b792-e3f94e670ad0",
                    "promptReference": "PENPT",
                    "label": "Penalty points for this offence",
                    "value": "6"
                  },
                  {
                    "promptIdentifier": "a593ae4a-9d69-45b9-9585-c11aeed28404",
                    "promptReference": "defendantDrivingLicenceNumber",
                    "label": "Defendant driving licence number",
                    "value": "ABCDE0,0010BCFAA"
                  }
                ],
                "d20": true,
                "label": "Driving record endorsed with penalty points"
              },
              {
                "resultIdentifier": "b9c6047b-fb84-4b12-97a1-2175e4b8bbac",
                "publishedForNows": false,
                "resultWording": "",
                "d20": false,
                "dvlaCode": "J",
                "label": "Absolute discharge"
              },
              {
                "resultIdentifier": "55f15ecf-ea80-40f4-848d-29e7b8d73ae2",
                "publishedForNows": false,
                "prompts": [
                  {
                    "promptIdentifier": "80dd4486-fa86-41f0-b09b-bad84b55f61c",
                    "promptReference": "CADATE",
                    "label": "Date appeal heard",
                    "value": "05/05/2023"
                  }
                ],
                "d20": false,
                "label": "Sentence varied"
              }
            ]
          }
        ]
      }
    ],
    "courtApplications": [
      {
        "applicationType": "Appeal against sentence by a Magistrates' Court to the Crown Court",
        "applicationReceivedDate": "2023-05-05",
        "id": "ec1e74d7-3584-44e2-ab05-37bc10d216e6",
        "applicationReference": "JW98466038",
        "applicationStatus": "UN_ALLOCATED",
        "results": [
          {
            "resultIdentifier": "d861586a-df88-440d-98d4-63cc2a680ae1",
            "publishedForNows": false,
            "prompts": [
              {
                "promptIdentifier": "c946a5df-5849-4cca-b425-ecbd6bd704dc",
                "promptReference": "dateSentenceWasImposed",
                "label": "Date sentence was imposed",
                "value": "05/05/2023"
              },
              {
                "promptIdentifier": "c10b4c83-1856-4ca9-9592-d8b8183a0324",
                "promptReference": "reasons",
                "label": "Reasons",
                "value": "Test"
              }
            ],
            "resultWording": "",
            "d20": false,
            "label": "Appeal against sentence allowed"
          }
        ]
      }
    ]
  },
  "isReshare": true,
  "orderingHearingId": "c7913573-c44d-4292-bce4-d4e52c5104c4"
}
