{
  "masterDefendantId": "ee9a5141-e50e-45ba-a30f-340ad3c0d43f",
  "orderingCourt": {
    "address": {
      "address1": "1 Queen Victoria Street",
      "address2": "London",
      "address3": "",
      "address4": "",
      "address5": "",
      "postcode": "EC4N 4XY"
    },
    "code": "B01DU00",
    "courtHearingLocation": "B01DU02",
    "id": "c133d0de-c989-48b9-bd20-0431943e347e",
    "lja": {
      "ljaCode": "2570",
      "ljaName": "Central London Magistrates' Court"
    },
    "name": "City of London Magistrates' Court",
    "roomId": "6d335b1f-769f-3120-bcda-c5d7c0725d3a",
    "roomName": "Courtroom 02"
  },
  "nowContent": {
    "orderDate": "2026-05-12",
    "defendant": {
      "dateOfBirth": "1999-05-12",
      "gender": "MALE",
      "driverNumber": "VANFL002222OW9PH",
      "title": "Mr",
      "firstName": "Rosamond",
      "lastName": "Schulist",
      "name": "Rosamond Schulist",
      "address": {
        "line1": "33 Bridge Street",
        "line2": "Bridge Street",
        "line3": "Stratford-upon-Avon",
        "line4": "Warwickshire",
        "postCode": "NW1 5BR"
      }
    },
    "caseApplicationReferences": [
      "QL408573247"
    ],
    "cases": [
      {
        "caseStatus": "ACTIVE",
        "initiationCode": "C",
        "reference": "QL408573247",
        "caseId": "5ec90ae4-ca1f-47bd-9754-5d4aa98cd75c",
        "defendantCaseOffences": [
          {
            "title": "Attempt theft of motor vehicle",
            "civilOffence": false,
            "dvlaCode": "NE99",
            "convictionDate": "2026-05-12",
            "convictionStatus": "Convicted",
            "plea": "GUILTY",
            "alcoholReadingAmount": 500,
            "alcoholReadingMethodCode": "A",
            "alcoholReadingMethodDescription": "Blood",
            "code": "TH68013A",
            "modeOfTrial": "Either Way",
            "endorsableFlag": false,
            "convictingCourtCode": "2570",
            "wording": "Attempt theft to vehicle",
            "startDate": "2026-03-13",
            "results": [
              {
                "resultIdentifier": "554c2622-c1cc-459e-a98d-b7f317ab065c",
                "publishedForNows": false,
                "prompts": [
                  {
                    "promptIdentifier": "d3205319-84cf-4c5b-9d7a-7e4bb1865054",
                    "promptReference": "periodofConditionalDischarge",
                    "durationSequence": 1,
                    "label": "Period of conditional discharge",
                    "value": "46 Weeks"
                  }
                ],
                "d20": false,
                "dvlaCode": "E",
                "judicialResultCategory": "FINAL",
                "label": "Conditional discharge"
              },
              {
                "resultIdentifier": "ccfc452e-ebe4-4cd7-b8a0-4f90768447b4",
                "publishedForNows": false,
                "prompts": [
                  {
                    "promptIdentifier": "11a939b1-71e6-4065-8c29-007e4b52da7a",
                    "promptReference": "licenceIssueNumber",
                    "label": "Licence issue number",
                    "value": "23"
                  },
                  {
                    "promptIdentifier": "2bf54447-328c-4c1b-a123-341adbd52172",
                    "promptReference": "disqualificationPeriod",
                    "durationSequence": 1,
                    "label": "Disqualification period",
                    "value": "6 Months"
                  },
                  {
                    "promptIdentifier": "a593ae4a-9d69-45b9-9585-c11aeed28404",
                    "promptReference": "defendantDrivingLicenceNumber",
                    "label": "Defendant driving licence number",
                    "value": "VANFL002222OW9PH"
                  }
                ],
                "resultWording": "Disqualified for holding or obtaining a driving licence. Discretionary disqualification. Driving record endorsed. Section 34(2) Road Traffic Offenders Act 1988",
                "d20": true,
                "judicialResultCategory": "ANCILLARY",
                "label": "Discretionary with ordinary disqualification"
              },
              {
                "resultIdentifier": "4b850aa9-984c-4a15-a1ae-b2f861cfcbe8",
                "publishedForNows": true,
                "prompts": [
                  {
                    "promptIdentifier": "11a939b1-71e6-4065-8c29-007e4b52da7a",
                    "promptReference": "licenceIssueNumber",
                    "label": "Licence issue number",
                    "value": "23"
                  }
                ],
                "d20": false,
                "judicialResultCategory": "ANCILLARY",
                "label": "1: Prov DVLA produced"
              }
            ]
          }
        ]
      }
    ]
  },
  "isReshare": false,
  "orderingHearingId": "eb45f516-8138-4654-8c85-81ca5d0f4fdb"
}