{
  "masterDefendantId": "%DEFENDANT_ID%",
  "orderingCourt": {
    "address": {
      "address1": "176A Lavender Hill",
      "address2": "London",
      "address3": "",
      "address4": "",
      "address5": "",
      "postcode": "SW11 1JU"
    },
    "code": "B01LY00",
    "courtHearingLocation": "B01LY01",
    "id": "f8254db1-1683-483e-afb3-b87fde5a0a26",
    "lja": {
      "ljaCode": "2577",
      "ljaName": "South West London Magistrates' Court"
    },
    "name": "Lavender Hill Magistrates' Court",
    "roomId": "9e4932f7-97b2-3010-b942-ddd2624e4dd8",
    "roomName": "Courtroom 01"
  },
  "nowContent": {
    "orderDate": "2023-04-23",
    "defendant": {
      "dateOfBirth": "1985-08-14",
      "gender": "MALE",
      "driverNumber": "ABCDE0,0010BCFAA",
      "title": "MR",
      "firstName": "Claude",
      "middleName": "Jasmine Jasmine",
      "lastName": "EVERTON",
      "name": "Claude Jasmine Jasmine EVERTON",
      "address": {
        "line1": "56saon",
        "line2": "56Police House",
        "line3": "StreetDescription1",
        "line4": "Locality1",
        "line5": "Leeds",
        "postCode": "TW13 4AA"
      }
    },
    "caseApplicationReferences": [
      "JW169482597"
    ],
    "cases": [
      {
        "reference": "JW169482597",
        "caseId": "8f62c81d-9610-4234-a915-c4132d369bcf",
        "defendantCaseOffences": [
          {
            "title": "Cause use of motor vehicle with no insurance",
            "civilOffence": false,
            "dvlaCode": "IN14",
            "endDate": "2020-09-17",
            "convictionDate": "2023-04-23",
            "convictionStatus": "Convicted",
            "plea": "GUILTY",
            "vehicleRegistration": "TE4654",
            "alcoholReadingAmount": 500,
            "alcoholReadingMethodCode": "A",
            "alcoholReadingMethodDescription": "Blood",
            "code": "RT88319",
            "modeOfTrial": "Summary",
            "allocationDecision": "Summary-only offence",
            "endorsableFlag": true,
            "convictingCourtCode": "2577",
            "wording": "Has a violent past and fear that he will commit further offences and interfere with witnesse",
            "startDate": "2020-09-18",
            "results": [
              {
                "resultIdentifier": "969f150c-cd05-46b0-9dd9-30891efcc766",
                "publishedForNows": false,
                "prompts": [
                  {
                    "promptIdentifier": "7cd1472f-2379-4f5b-9e67-98a43d86e122",
                    "promptReference": "AOF",
                    "label": "Amount of fine",
                    "value": "Â£100.00"
                  }
                ],
                "resultDefinitionGroup": "Imposition",
                "d20": false,
                "label": "Fine"
              }
            ]
          }
        ]
      }
    ]
  },
  "isReshare": true,
  "orderingHearingId": "0f97e46a-8e4a-49c4-8849-53f8157972be"
}