{
  "masterDefendantId": "%DEFENDANT_ID%",
  "orderingCourt": {
    "address": {
      "address1": "1 Queen Victoria Street",
      "address2": "London",
      "address3": "",
      "address4": "",
      "address5": "",
      "postcode": "EC4N 4XY"
    },
    "code": "B01DU00",
    "courtHearingLocation": "B01DU02",
    "id": "c133d0de-c989-48b9-bd20-0431943e347e",
    "lja": {
      "ljaCode": "2570",
      "ljaName": "Central London Magistrates' Court"
    },
    "name": "City of London Magistrates' Court",
    "roomId": "6d335b1f-769f-3120-bcda-c5d7c0725d3a",
    "roomName": "Courtroom 02"
  },
  "nowContent": {
    "orderDate": "2024-10-14",
    "defendant": {
      "dateOfBirth": "2000-01-01",
      "gender": "MALE",
      "driverNumber": "ULLRI611187XH9ZM",
      "firstName": "Jillian",
      "lastName": "Pfannerstill",
      "name": "Jillian Pfannerstill",
      "address": {
        "line1": "FLAT - 25A",
        "line2": "55464 Earlene Islands",
        "line3": "Swansea",
        "line4": "Walsh",
        "line5": "UK",
        "postCode": "SA1 1AU"
      }
    },
    "caseApplicationReferences": [
      "DVLA02022364"
    ],
    "cases": [
      {
        "reference": "DVLA02022364",
        "caseId": "ade7da53-fd6b-446f-828f-2bdedfd2be4d",
        "defendantCaseOffences": []
      }
    ],
    "courtApplications": [
      {
        "applicationType": "Appeal against sentence by a Magistrates' Court to the Crown Court",
        "applicationReceivedDate": "2024-10-01",
        "id": "0eb83dff-5cd2-4f81-8ead-f847018d57c3",
        "applicationReference": "DVLA02022364",
        "applicationStatus": "UN_ALLOCATED",
        "results": [
          {
            "resultIdentifier": "2b3f7c20-8fc1-4fad-9076-df196c24b27e",
            "publishedForNows": false,
            "d20": false,
            "label": "Granted"
          },
          {
            "resultIdentifier": "4ad82d44-41cc-4e47-a2f5-e0dd147320ee",
            "publishedForNows": true,
            "d20": true,
            "label": "Driving disqualification stands"
          }
        ]
      }
    ]
  },
  "isReshare": true,
  "orderingHearingId": "e35a5151-986c-417f-ae23-8fc647e9a759"
}